#queryIndex	queryItem	stringId	preferredName	annotation
282	3339	9606.ENSP00000363827	HSPG2	Basement membrane-specific heparan sulfate proteoglycan core protein; Integral component of basement membranes. Component of the glomerular basement membrane (GBM), responsible for the fixed negative electrostatic membrane charge, and which provides a barrier which is both size- and charge-selective. It serves as an attachment substrate for cells. Plays essential roles in vascularization. Critical for normal heart development and for regulating the vascular response to injury. Also required for avascular cartilage development. The LG3 peptide has anti-angiogenic properties that require [...] 
283	3361	9606.ENSP00000287907	HTR5A	5-hydroxytryptamine receptor 5A; This is one of the several different receptors for 5- hydroxytryptamine (serotonin), a biogenic hormone that functions as a neurotransmitter, a hormone, and a mitogen. The activity of this receptor is mediated by G proteins; Belongs to the G-protein coupled receptor 1 family.
284	3375	9606.ENSP00000240652	IAPP	Islet amyloid polypeptide; Selectively inhibits insulin-stimulated glucose utilization and glycogen deposition in muscle, while not affecting adipocyte glucose metabolism; Belongs to the calcitonin family.
285	3386	9606.ENSP00000342114	ICAM4	Intercellular adhesion molecule 4; ICAM proteins are ligands for the leukocyte adhesion protein LFA-1 (integrin alpha-L/beta-2). ICAM4 is also a ligand for alpha- 4/beta-1 and alpha-V integrins.
288	3397	9606.ENSP00000365280	ID1	DNA-binding protein inhibitor ID-1; Transcriptional regulator (lacking a basic DNA binding domain) which negatively regulates the basic helix-loop-helix (bHLH) transcription factors by forming heterodimers and inhibiting their DNA binding and transcriptional activity. Implicated in regulating a variety of cellular processes, including cellular growth, senescence, differentiation, apoptosis, angiogenesis, and neoplastic transformation. Inhibits skeletal muscle and cardiac myocyte differentiation. Regulates the circadian clock by repressing the transcriptional activator activity of the C [...] 
289	340390	9606.ENSP00000320648	WDR97	WD repeat domain 97.
290	340542	9606.ENSP00000446054	BEX5	Protein BEX5; Brain expressed X-linked 5; Belongs to the BEX family.
291	340547	9606.ENSP00000402219	VSIG1	V-set and immunoglobulin domain containing 1.
292	342357	9606.ENSP00000331626	ZKSCAN2	Zinc finger protein with KRAB and SCAN domains 2; May be involved in transcriptional regulation.
293	3441	9606.ENSP00000412897	IFNA4	Interferon alpha-4; Produced by macrophages, IFN-alpha have antiviral activities. Interferon stimulates the production of two enzymes: a protein kinase and an oligoadenylate synthetase; Belongs to the alpha/beta interferon family.
294	3444	9606.ENSP00000239347	IFNA7	Interferon alpha-7; Produced by macrophages, IFN-alpha have antiviral activities. Interferon stimulates the production of two enzymes: a protein kinase and an oligoadenylate synthetase; Belongs to the alpha/beta interferon family.
295	346171	9606.ENSP00000418259	ZFP57	Zinc finger protein 57 homolog; Transcription regulator required to maintain maternal and paternal gene imprinting, a process by which gene expression is restricted in a parent of origin-specific manner by epigenetic modification of genomic DNA and chromatin, including DNA methylation. Acts by controlling DNA methylation during the earliest multicellular stages of development at multiple imprinting control regions (ICRs). Acts together with ZNF445, but ZNF445 seems to be the major factor in human early embryonic imprinting maintenance. In contrast, in mice, ZFP57 plays the predominant  [...] 
296	347733	9606.ENSP00000259818	TUBB2B	Tubulin beta-2B chain; Tubulin is the major constituent of microtubules. It binds two moles of GTP, one at an exchangeable site on the beta chain and one at a non- exchangeable site on the alpha chain (By similarity). Plays a critical role in proper axon guidance in both central and peripheral axon tracts. Implicated in neuronal migration. Belongs to the tubulin family.
297	348932	9606.ENSP00000323549	SLC6A18	Inactive sodium-dependent neutral amino acid transporter B(0)AT3; Does not show neutral amino acid transporter activity.
302	3596	9606.ENSP00000304915	IL13	Interleukin-13; Cytokine. Inhibits inflammatory cytokine production. Synergizes with IL2 in regulating interferon-gamma synthesis. May be critical in regulating inflammatory and immune responses. Positively regulates IL31RA expression in macrophages (By similarity).
303	360205	9606.ENSP00000484945	PRAC2	PRAC2 small nuclear protein.
304	3627	9606.ENSP00000305651	CXCL10	C-X-C motif chemokine 10; Pro-inflammatory cytokine that is involved in a wide variety of processes such as chemotaxis, differentiation, and activation of peripheral immune cells, regulation of cell growth, apoptosis and modulation of angiostatic effects. Plays thereby an important role during viral infections by stimulating the activation and migration of immune cells to the infected sites (By similarity). Mechanistically, binding of CXCL10 to the CXCR3 receptor activates G protein-mediated signaling and results in downstream activation of phospholipase C-dependent pathway, an increas [...] 
305	3645	9606.ENSP00000357178	INSRR	Insulin receptor-related protein alpha chain; Receptor with tyrosine-protein kinase activity. Functions as a pH sensing receptor which is activated by increased extracellular pH. Activates an intracellular signaling pathway that involves IRS1 and AKT1/PKB.
306	3670	9606.ENSP00000230658	ISL1	Insulin gene enhancer protein ISL-1; DNA-binding transcriptional activator. Recognizes and binds to the consensus octamer binding site 5'-ATAATTAA-3' in promoter of target genes. Plays a fundamental role in the gene regulatory network essential for retinal ganglion cell (RGC) differentiation. Cooperates with the transcription factor POU4F2 to achieve maximal levels of expression of RGC target genes and RGC fate specification in the developing retina. Involved in the specification of motor neurons in cooperation with LHX3 and LDB1. Binds to insulin gene enhancer sequences. Essential for [...] 
307	3695	9606.ENSP00000267082	ITGB7	Integrin beta-7; Integrin alpha-4/beta-7 (Peyer patches-specific homing receptor LPAM-1) is an adhesion molecule that mediates lymphocyte migration and homing to gut-associated lymphoid tissue (GALT). Integrin alpha-4/beta-7 interacts with the cell surface adhesion molecules MADCAM1 which is normally expressed by the vascular endothelium of the gastrointestinal tract. Interacts also with VCAM1 and fibronectin, an extracellular matrix component. It recognizes one or more domains within the alternatively spliced CS-1 region of fibronectin. Interactions involves the tripeptide L-D-T in MA [...] 
308	3704	9606.ENSP00000369456	ITPA	Inosine triphosphate pyrophosphatase; Pyrophosphatase that hydrolyzes the non-canonical purine nucleotides inosine triphosphate (ITP), deoxyinosine triphosphate (dITP) as well as 2'-deoxy-N-6-hydroxylaminopurine triposphate (dHAPTP) and xanthosine 5'-triphosphate (XTP) to their respective monophosphate derivatives. The enzyme does not distinguish between the deoxy- and ribose forms. Probably excludes non-canonical purines from RNA and DNA precursor pools, thus preventing their incorporation into RNA and DNA and avoiding chromosomal lesions; Belongs to the HAM1 NTPase family.
311	374946	9606.ENSP00000294485	DRAXIN	Draxin; Chemorepulsive axon guidance protein required for the development of spinal cord and forebrain commissures. Acts as a chemorepulsive guidance protein for commissural axons during development. Able to inhibit or repel neurite outgrowth from dorsal spinal cord. Inhibits the stabilization of cytosolic beta-catenin (CTNNB1) via its interaction with LRP6, thereby acting as an antagonist of Wnt signaling pathway; Belongs to the draxin family.
312	375061	9606.ENSP00000355614	FAM89A	Protein FAM89A; Family with sequence similarity 89 member A; Belongs to the FAM89 family.
313	3756	9606.ENSP00000271751	KCNH1	Potassium voltage-gated channel subfamily H member 1; Pore-forming (alpha) subunit of a voltage-gated delayed rectifier potassium channel. Channel properties are modulated by subunit assembly. Mediates IK(NI) current in myoblasts. Involved in the regulation of cell proliferation and differentiation, in particular adipogenic and osteogenic differentiation in bone marrow-derived mesenchymal stem cells (MSCs). Belongs to the potassium channel family. H (Eag) (TC 1.A.1.20) subfamily. Kv10.1/KCNH1 sub-subfamily.
314	3767	9606.ENSP00000345708	KCNJ11	ATP-sensitive inward rectifier potassium channel 11; This receptor is controlled by G proteins. Inward rectifier potassium channels are characterized by a greater tendency to allow potassium to flow into the cell rather than out of it. Their voltage dependence is regulated by the concentration of extracellular potassium; as external potassium is raised, the voltage range of the channel opening shifts to more positive voltages. The inward rectification is mainly due to the blockage of outward current by internal magnesium. Can be blocked by extracellular barium (By similarity). Subunit  [...] 
315	3773	9606.ENSP00000465295	KCNJ16	Inward rectifier potassium channel 16; Inward rectifier potassium channels are characterized by a greater tendency to allow potassium to flow into the cell rather than out of it. Their voltage dependence is regulated by the concentration of extracellular potassium; as external potassium is raised, the voltage range of the channel opening shifts to more positive voltages. The inward rectification is mainly due to the blockage of outward current by internal magnesium. KCNJ16 may be involved in the regulation of fluid and pH balance. In the kidney, together with KCNJ10, mediates basolater [...] 
316	379	9606.ENSP00000322628	ARL4D	ADP-ribosylation factor-like protein 4D; Small GTP-binding protein which cycles between an inactive GDP-bound and an active GTP-bound form, and the rate of cycling is regulated by guanine nucleotide exchange factors (GEF) and GTPase- activating proteins (GAP). GTP-binding protein that does not act as an allosteric activator of the cholera toxin catalytic subunit. Recruits CYTH1, CYTH2, CYTH3 and CYTH4 to the plasma membrane in GDP-bound form.
317	3795	9606.ENSP00000260599	KHK	Ketohexokinase; Catalyzes the phosphorylation of the ketose sugar fructose to fructose-1-phosphate.
318	3811	9606.ENSP00000375608	KIR3DL1	Killer cell immunoglobulin-like receptor 3DL1; Receptor on natural killer (NK) cells for HLA Bw4 allele. Inhibits the activity of NK cells thus preventing cell lysis.
319	3821	9606.ENSP00000438038	KLRC1	NKG2-A/NKG2-B type II integral membrane protein; Plays a role as a receptor for the recognition of MHC class I HLA-E molecules by NK cells and some cytotoxic T-cells.
320	388228	9606.ENSP00000343248	SBK1	Serine/threonine-protein kinase SBK1; May be involved in signal-transduction pathways related to the control of brain development; Belongs to the protein kinase superfamily. Ser/Thr protein kinase family.
321	388650	9606.ENSP00000359333	DIPK1A	Divergent protein kinase domain 1A.
323	389	9606.ENSP00000285735	RHOC	Rho-related GTP-binding protein RhoC; Regulates a signal transduction pathway linking plasma membrane receptors to the assembly of focal adhesions and actin stress fibers. Serves as a microtubule-dependent signal that is required for the myosin contractile ring formation during cell cycle cytokinesis. Regulates apical junction formation in bronchial epithelial cells.
324	389058	9606.ENSP00000364430	SP5	Transcription factor Sp5; Binds to GC boxes promoters elements. Probable transcriptional activator that has a role in the coordination of changes in transcription required to generate pattern in the developing embryo (By similarity).
325	3892	9606.ENSP00000444533	KRT86	Keratin, type II cuticular Hb6.
327	389903	9606.ENSP00000492276	CSAG3	Chondrosarcoma-associated gene 2/3 protein; Drug-resistance related protein, its expression is associated with the chemotherapy resistant and neoplastic phenotype. May also be linked to the malignant phenotype.
328	3902	9606.ENSP00000203629	LAG3	Secreted lymphocyte activation gene 3 protein; Lymphocyte activation gene 3 protein: Inhibitory receptor on antigen activated T-cells. Delivers inhibitory signals upon binding to ligands, such as FGL1 (By similarity). FGL1 constitutes a major ligand of LAG3 and is responsible for LAG3 T-cell inhibitory function (By similarity). Following TCR engagement, LAG3 associates with CD3-TCR in the immunological synapse and directly inhibits T-cell activation (By similarity). May inhibit antigen-specific T-cell activation in synergy with PDCD1/PD-1, possibly by acting as a coreceptor for PDCD1/P [...] 
329	390874	9606.ENSP00000371786	ONECUT3	One cut domain family member 3; Transcriptional activator. Binds the consensus DNA sequence 5'-DHWATTGAYTWWD-3' on a variety of gene promoters such as those of HNF3B and TTR (By similarity); Belongs to the CUT homeobox family.
330	3914	9606.ENSP00000375778	LAMB3	Laminin subunit beta-3; Binding to cells via a high affinity receptor, laminin is thought to mediate the attachment, migration and organization of cells into tissues during embryonic development by interacting with other extracellular matrix components.
331	3959	9606.ENSP00000262776	LGALS3BP	Galectin-3-binding protein; Promotes integrin-mediated cell adhesion. May stimulate host defense against viruses and tumor cells.
332	3960	9606.ENSP00000302100	LGALS4	Galectin-4; Galectin that binds lactose and a related range of sugars. May be involved in the assembly of adherens junctions.
338	401190	9606.ENSP00000334851	RGS7BP	Regulator of G-protein signaling 7-binding protein; Regulator of G protein-coupled receptor (GPCR) signaling. Regulatory subunit of the R7-Gbeta5 complexes that acts by controlling the subcellular location of the R7-Gbeta5 complexes. When palmitoylated, it targets the R7-Gbeta5 complexes to the plasma membrane, leading to inhibit G protein alpha subunits. When it is unpalmitoylated, the R7-Gbeta5 complexes undergo a nuclear/cytoplasmic shuttling. May also act by controlling the proteolytic stability of R7 proteins, probably by protecting them from degradation.
340	4016	9606.ENSP00000261921	LOXL1	Lysyl oxidase homolog 1; Active on elastin and collagen substrates.
341	4017	9606.ENSP00000373783	LOXL2	Lysyl oxidase homolog 2; Mediates the post-translational oxidative deamination of lysine residues on target proteins leading to the formation of deaminated lysine (allysine). Acts as a transcription corepressor and specifically mediates deamination of trimethylated 'Lys-4' of histone H3 (H3K4me3), a specific tag for epigenetic transcriptional activation. Shows no activity against histone H3 when it is trimethylated on 'Lys-9' (H3K9me3) or 'Lys-27' (H3K27me3) or when 'Lys-4' is monomethylated (H3K4me1) or dimethylated (H3K4me2). Also mediates deamination of methylated TAF10, a member of [...] 
342	4063	9606.ENSP00000263285	LY9	T-lymphocyte surface antigen Ly-9; Self-ligand receptor of the signaling lymphocytic activation molecule (SLAM) family. SLAM receptors triggered by homo- or heterotypic cell-cell interactions are modulating the activation and differentiation of a wide variety of immune cells and thus are involved in the regulation and interconnection of both innate and adaptive immune response. Activities are controlled by presence or absence of small cytoplasmic adapter proteins, SH2D1A/SAP and/or SH2D1B/EAT-2. May participate in adhesion reactions between T lymphocytes and accessory cells by homophil [...] 
344	4145	9606.ENSP00000378485	MATK	Megakaryocyte-associated tyrosine-protein kinase; Could play a significant role in the signal transduction of hematopoietic cells. May regulate tyrosine kinase activity of SRC- family members in brain by specifically phosphorylating their C- terminal regulatory tyrosine residue which acts as a negative regulatory site. It may play an inhibitory role in the control of T- cell proliferation.
346	4160	9606.ENSP00000299766	MC4R	Melanocortin receptor 4; Receptor specific to the heptapeptide core common to adrenocorticotropic hormone and alpha-, beta-, and gamma-MSH. Plays a central role in energy homeostasis and somatic growth. This receptor is mediated by G proteins that stimulate adenylate cyclase (cAMP).
347	4285	9606.ENSP00000371607	MIPEP	Mitochondrial intermediate peptidase; Cleaves proteins, imported into the mitochondrion, to their mature size.
348	4288	9606.ENSP00000357643	MKI67	Proliferation marker protein Ki-67; Required to maintain individual mitotic chromosomes dispersed in the cytoplasm following nuclear envelope disassembly. Associates with the surface of the mitotic chromosome, the perichromosomal layer, and covers a substantial fraction of the chromosome surface. Prevents chromosomes from collapsing into a single chromatin mass by forming a steric and electrostatic charge barrier: the protein has a high net electrical charge and acts as a surfactant, dispersing chromosomes and enabling independent chromosome motility. Binds DNA, with a preference for s [...] 
349	429	9606.ENSP00000266744	ASCL1	Achaete-scute homolog 1; Transcription factor that plays a key role in neuronal differentiation: acts as a pioneer transcription factor, accessing closed chromatin to allow other factors to bind and activate neural pathways. Directly binds the E box motif (5'-CANNTG-3') on promoters and promotes transcription of neuronal genes. The combination of three transcription factors, ASCL1, POU3F2/BRN2 and MYT1L, is sufficient to reprogram fibroblasts and other somatic cells into induced neuronal (iN) cells in vitro. Plays a role at early stages of development of specific neural lineages in mos [...] 
350	4311	9606.ENSP00000418525	MME	Neprilysin; Thermolysin-like specificity, but is almost confined on acting on polypeptides of up to 30 amino acids. Biologically important in the destruction of opioid peptides such as Met- and Leu-enkephalins by cleavage of a Gly-Phe bond. Able to cleave angiotensin-1, angiotensin-2 and angiotensin 1-9. Involved in the degradation of atrial natriuretic factor (ANF). Displays UV-inducible elastase activity toward skin preelastic and elastic fibers. Belongs to the peptidase M13 family.
351	4321	9606.ENSP00000458585	MMP12	Macrophage metalloelastase; May be involved in tissue injury and remodeling. Has significant elastolytic activity. Can accept large and small amino acids at the P1' site, but has a preference for leucine. Aromatic or hydrophobic residues are preferred at the P1 site, with small hydrophobic residues (preferably alanine) occupying P3; Belongs to the peptidase M10A family.
352	4345	9606.ENSP00000420298	CD200	OX-2 membrane glycoprotein; Costimulates T-cell proliferation. May regulate myeloid cell activity in a variety of tissues.
353	440	9606.ENSP00000377845	ASNS	Asparagine synthetase.
356	4541	9606.ENSP00000354665	MT-ND6	NADH-ubiquinone oxidoreductase chain 6; Core subunit of the mitochondrial membrane respiratory chain NADH dehydrogenase (Complex I) that is believed to belong to the minimal assembly required for catalysis. Complex I functions in the transfer of electrons from NADH to the respiratory chain. The immediate electron acceptor for the enzyme is believed to be ubiquinone (By similarity).
357	4599	9606.ENSP00000381601	MX1	Interferon-induced GTP-binding protein Mx1, N-terminally processed; Interferon-induced dynamin-like GTPase with antiviral activity against a wide range of RNA viruses and some DNA viruses. Its target viruses include negative-stranded RNA viruses and HBV through binding and inactivation of their ribonucleocapsid. May also antagonize reoviridae and asfarviridae replication. Inhibits thogoto virus (THOV) replication by preventing the nuclear import of viral nucleocapsids. Inhibits La Crosse virus (LACV) replication by sequestering viral nucleoprotein in perinuclear complexes, preventing g [...] 
358	4619	9606.ENSP00000226207	MYH1	Myosin-1; Muscle contraction; Belongs to the TRAFAC class myosin-kinesin ATPase superfamily. Myosin family.
359	4654	9606.ENSP00000250003	MYOD1	Myoblast determination protein 1; Acts as a transcriptional activator that promotes transcription of muscle-specific target genes and plays a role in muscle differentiation. Together with MYF5 and MYOG, co-occupies muscle-specific gene promoter core region during myogenesis. Induces fibroblasts to differentiate into myoblasts. Interacts with and is inhibited by the twist protein. This interaction probably involves the basic domains of both proteins (By similarity).
360	4675	9606.ENSP00000362171	NAP1L3	Nucleosome assembly protein 1 like 3.
361	4680	9606.ENSP00000199764	CEACAM6	Carcinoembryonic antigen-related cell adhesion molecule 6; Cell surface glycoprotein that plays a role in cell adhesion and tumor progression. Intercellular adhesion occurs in a calcium- and fibronectin-independent manner. Mediates homophilic and heterophilic cell adhesion with other carcinoembryonic antigen-related cell adhesion molecules, such as CEACAM5 and CEACAM8. Heterophilic interaction with CEACAM8 occurs in activated neutrophils. Plays a role in neutrophil adhesion to cytokine-activated endothelial cells. Plays a role as an oncogene by promoting tumor progression; positively r [...] 
363	4935	9606.ENSP00000417161	GPR143	G-protein coupled receptor 143; Receptor for tyrosine, L-DOPA and dopamine. After binding to L-DOPA, stimulates Ca(2+) influx into the cytoplasm, increases secretion of the neurotrophic factor SERPINF1 and relocalizes beta arrestin at the plasma membrane; this ligand-dependent signaling occurs through a G(q)-mediated pathway in melanocytic cells. Its activity is mediated by G proteins which activate the phosphoinositide signaling pathway. Plays also a role as an intracellular G protein-coupled receptor involved in melanosome biogenesis, organization and transport.
364	4940	9606.ENSP00000228928	OAS3	2'-5'-oligoadenylate synthase 3; Interferon-induced, dsRNA-activated antiviral enzyme which plays a critical role in cellular innate antiviral response. In addition, it may also play a role in other cellular processes such as apoptosis, cell growth, differentiation and gene regulation. Synthesizes preferentially dimers of 2'-5'-oligoadenylates (2-5A) from ATP which then bind to the inactive monomeric form of ribonuclease L (RNase L) leading to its dimerization and subsequent activation. Activation of RNase L leads to degradation of cellular as well as viral RNA, resulting in the inhibi [...] 
367	4990	9606.ENSP00000328596	SIX6	Homeobox protein SIX6; May be involved in eye development.
368	5019	9606.ENSP00000196371	OXCT1	Succinyl-CoA:3-ketoacid coenzyme A transferase 1, mitochondrial; Key enzyme for ketone body catabolism. Transfers the CoA moiety from succinate to acetoacetate. Formation of the enzyme-CoA intermediate proceeds via an unstable anhydride species formed between the carboxylate groups of the enzyme and substrate; Belongs to the 3-oxoacid CoA-transferase family.
370	50805	9606.ENSP00000482393	IRX4	Iroquois-class homeodomain protein IRX-4; Likely to be an important mediator of ventricular differentiation during cardiac development.
371	5092	9606.ENSP00000299299	PCBD1	Pterin-4-alpha-carbinolamine dehydratase; Involved in tetrahydrobiopterin biosynthesis. Seems to both prevent the formation of 7-pterins and accelerate the formation of quinonoid-BH2. Coactivator for HNF1A-dependent transcription. Regulates the dimerization of homeodomain protein HNF1A and enhances its transcriptional activity; Belongs to the pterin-4-alpha-carbinolamine dehydratase family.
372	50944	9606.ENSP00000293441	SHANK1	SH3 and multiple ankyrin repeat domains protein 1; Seems to be an adapter protein in the postsynaptic density (PSD) of excitatory synapses that interconnects receptors of the postsynaptic membrane including NMDA-type and metabotropic glutamate receptors via complexes with GKAP/PSD-95 and Homer, respectively, and the actin-based cytoskeleton. Plays a role in the structural and functional organization of the dendritic spine and synaptic junction; Belongs to the SHANK family.
373	5111	9606.ENSP00000368458	PCNA	Proliferating cell nuclear antigen; Auxiliary protein of DNA polymerase delta and is involved in the control of eukaryotic DNA replication by increasing the polymerase's processibility during elongation of the leading strand. Induces a robust stimulatory effect on the 3'-5' exonuclease and 3'- phosphodiesterase, but not apurinic-apyrimidinic (AP) endonuclease, APEX2 activities. Has to be loaded onto DNA in order to be able to stimulate APEX2. Plays a key role in DNA damage response (DDR) by being conveniently positioned at the replication fork to coordinate DNA replication with DNA rep [...] 
374	51191	9606.ENSP00000264350	HERC5	E3 ISG15--protein ligase HERC5; Major E3 ligase for ISG15 conjugation. Acts as a positive regulator of innate antiviral response in cells induced by interferon. Functions as part of the ISGylation machinery that recognizes target proteins in a broad and relatively non-specific manner. Catalyzes ISGylation of IRF3 which results in sustained activation, it attenuates IRF3-PIN1 interaction, which antagonizes IRF3 ubiquitination and degradation, and boosts the antiviral response. Catalyzes ISGylation of influenza A viral NS1 which attenuates virulence; ISGylated NS1 fails to form homodimer [...] 
375	51250	9606.ENSP00000485698	MTRES1	Mitochondrial transcription rescue factor 1; Mitochondrial RNA-binding protein involved in mitochondrial transcription regulation. Functions as a protective factor to maintain proper mitochondrial RNA level during stress. Acts at the transcription level and its protective function depends on its RNA binding ability.
