#queryIndex	queryItem	stringId	preferredName	annotation
188	170261	9606.ENSP00000308921	ZCCHC12	Zinc finger CCHC domain-containing protein 12; Transcriptional coactivator in the bone morphogenetic protein (BMP)-signaling pathway. It positively modulates BMP signaling by interacting with SMAD1 and associating with CBP in the transcription complex. It contributes to the BMP-induced enhancement of cholinergic- neuron-specific gene expression (By similarity).
189	1731	9606.ENSP00000324511	SEPTIN1	Septin-1; Filament-forming cytoskeletal GTPase (By similarity). May play a role in cytokinesis (Potential); Belongs to the TRAFAC class TrmE-Era-EngA-EngB-Septin-like GTPase superfamily. Septin GTPase family.
190	1789	9606.ENSP00000328547	DNMT3B	DNA (cytosine-5)-methyltransferase 3B; Required for genome-wide de novo methylation and is essential for the establishment of DNA methylation patterns during development. DNA methylation is coordinated with methylation of histones. May preferentially methylates nucleosomal DNA within the nucleosome core region. May function as transcriptional co-repressor by associating with CBX4 and independently of DNA methylation. Seems to be involved in gene silencing (By similarity). In association with DNMT1 and via the recruitment of CTCFL/BORIS, involved in activation of BAG1 gene expression by [...] 
191	1876	9606.ENSP00000370936	E2F6	Transcription factor E2F6; Inhibitor of E2F-dependent transcription. Binds DNA cooperatively with DP proteins through the E2 recognition site, 5'- TTTC[CG]CGC-3'. Has a preference for the 5'-TTTCCCGC-3' E2F recognition site. E2F6 lacks the transcriptional activation and pocket protein binding domains. Appears to regulate a subset of E2F-dependent genes whose products are required for entry into the cell cycle but not for normal cell cycle progression. May silence expression via the recruitment of a chromatin remodeling complex containing histone H3-K9 methyltransferase activity. Overex [...] 
192	196541	9606.ENSP00000267273	METTL21C	Protein-lysine methyltransferase METTL21C; Protein-lysine methyltransferase. Belongs to the methyltransferase superfamily. METTL21 family.
193	200081	9606.ENSP00000362711	TXLNA	Alpha-taxilin; May be involved in intracellular vesicle traffic and potentially in calcium-dependent exocytosis in neuroendocrine cells; Belongs to the taxilin family.
194	203111	9606.ENSP00000315614	ERICH5	Glutamate-rich protein 5; Glutamate rich 5.
195	203413	9606.ENSP00000360961	CT83	Kita-kyushu lung cancer antigen 1; Cancer/testis antigen 83.
196	2042	9606.ENSP00000337451	EPHA3	Ephrin type-A receptor 3; Receptor tyrosine kinase which binds promiscuously membrane- bound ephrin family ligands residing on adjacent cells, leading to contact-dependent bidirectional signaling into neighboring cells. The signaling pathway downstream of the receptor is referred to as forward signaling while the signaling pathway downstream of the ephrin ligand is referred to as reverse signaling. Highly promiscuous for ephrin-A ligands it binds preferentially EFNA5. Upon activation by EFNA5 regulates cell-cell adhesion, cytoskeletal organization and cell migration. Plays a role in ca [...] 
197	204474	9606.ENSP00000305465	PDILT	Protein disulfide-isomerase-like protein of the testis; Probable redox-inactive chaperone involved in spermatogenesis; Belongs to the protein disulfide isomerase family.
198	2059	9606.ENSP00000494689	EPS8	Epidermal growth factor receptor kinase substrate 8; Signaling adapter that controls various cellular protrusions by regulating actin cytoskeleton dynamics and architecture. Depending on its association with other signal transducers, can regulate different processes. Together with SOS1 and ABI1, forms a trimeric complex that participates in transduction of signals from Ras to Rac by activating the Rac-specific guanine nucleotide exchange factor (GEF) activity. Acts as a direct regulator of actin dynamics by binding actin filaments and has both barbed-end actin filament capping and acti [...] 
200	2118	9606.ENSP00000321835	ETV4	ETS translocation variant 4; Transcriptional activator that binds to the enhancer of the adenovirus E1A gene; the core-binding sequence is 5'[AC]GGA[AT]GT-3'.
201	2188	9606.ENSP00000330875	FANCF	Fanconi anemia group F protein; DNA repair protein that may operate in a postreplication repair or a cell cycle checkpoint function. May be implicated in interstrand DNA cross-link repair and in the maintenance of normal chromosome stability (By similarity).
202	2189	9606.ENSP00000367910	FANCG	Fanconi anemia group G protein; DNA repair protein that may operate in a postreplication repair or a cell cycle checkpoint function. May be implicated in interstrand DNA cross-link repair and in the maintenance of normal chromosome stability. Candidate tumor suppressor gene.
203	219623	9606.ENSP00000382237	TMEM26	Transmembrane protein 26.
204	219938	9606.ENSP00000299140	SPATA19	Spermatogenesis-associated protein 19, mitochondrial; May have a role in spermiogenesis.
205	2209	9606.ENSP00000358165	FCGR1A	High affinity immunoglobulin gamma Fc receptor I; High affinity receptor for the Fc region of immunoglobulins gamma. Functions in both innate and adaptive immune responses.
206	2210	9606.ENSP00000358391	FCGR1B	High affinity immunoglobulin gamma Fc receptor IB; May bind to the Fc region of immunoglobulins gamma with a low affinity compared to FCGR1A. May function in the humoral immune response.
207	222545	9606.ENSP00000309493	GPRC6A	G-protein coupled receptor family C group 6 member A; Receptor activated by amino acids with a preference for basic amino acids such as L-Lys, L-Arg and L-ornithine but also by small and polar amino acids. The L-alpha amino acids respond is augmented by divalent cations Ca(2+) and Mg(2+). Activated by extracellular calcium and osteocalcin. Seems to act through a G(q)/G(11) and G(i)-coupled pathway. Mediates the non-genomic effects of androgens in multiple tissue. May coordinate nutritional and hormonal anabolic signals through the sensing of extracellular amino acids, osteocalcin, diva [...] 
208	222643	9606.ENSP00000244565	UNC5CL	UNC5C-like protein; Inhibits NF-kappa-B-dependent transcription by impairing NF- kappa-B binding to its targets; Belongs to the unc-5 family.
209	2237	9606.ENSP00000305480	FEN1	Flap endonuclease 1; Structure-specific nuclease with 5'-flap endonuclease and 5'- 3' exonuclease activities involved in DNA replication and repair. During DNA replication, cleaves the 5'-overhanging flap structure that is generated by displacement synthesis when DNA polymerase encounters the 5'-end of a downstream Okazaki fragment. It enters the flap from the 5'-end and then tracks to cleave the flap base, leaving a nick for ligation. Also involved in the long patch base excision repair (LP-BER) pathway, by cleaving within the apurinic/apyrimidinic (AP) site- terminated flap. Acts as  [...] 
210	2254	9606.ENSP00000371790	FGF9	Fibroblast growth factor 9; Plays an important role in the regulation of embryonic development, cell proliferation, cell differentiation and cell migration. May have a role in glial cell growth and differentiation during development, gliosis during repair and regeneration of brain tissue after damage, differentiation and survival of neuronal cells, and growth stimulation of glial tumors; Belongs to the heparin-binding growth factors family.
211	22986	9606.ENSP00000358715	SORCS3	Sortilin related VPS10 domain containing receptor 3; Belongs to the VPS10-related sortilin family. SORCS subfamily.
212	22996	9606.ENSP00000393952	TTC39A	Tetratricopeptide repeat domain 39A.
213	23120	9606.ENSP00000313600	ATP10B	Probable phospholipid-transporting ATPase VB; Catalytic component of a P4-ATPase flippase complex which catalyzes the hydrolysis of ATP coupled to the transport of aminophospholipids from the outer to the inner leaflet of various membranes and ensures the maintenance of asymmetric distribution of phospholipids. Phospholipid translocation seems also to be implicated in vesicle formation and in uptake of lipid signaling molecules (Probable); Belongs to the cation transport ATPase (P-type) (TC 3.A.3) family. Type IV subfamily.
214	23138	9606.ENSP00000274605	N4BP3	NEDD4-binding protein 3; Plays a role in axon and dendrite arborization during cranial nerve development. May also be important for neural crest migration and early development of other anterior structures including eye, brain and cranial cartilage; Belongs to the N4BP3 family.
215	23243	9606.ENSP00000382379	ANKRD28	Serine/threonine-protein phosphatase 6 regulatory ankyrin repeat subunit A; Putative regulatory subunit of protein phosphatase 6 (PP6) that may be involved in the recognition of phosphoprotein substrates. Involved in the PP6-mediated dephosphorylation of NFKBIE opposing its degradation in response to TNF-alpha. Selectively inhibits the phosphatase activity of PPP1C. Targets PPP1C to modulate HNRPK phosphorylation.
216	23303	9606.ENSP00000427900	KIF13B	Kinesin-like protein KIF13B; Involved in reorganization of the cortical cytoskeleton. Regulates axon formation by promoting the formation of extra axons. May be functionally important for the intracellular trafficking of MAGUKs and associated protein complexes.
217	23344	9606.ENSP00000267113	ESYT1	Extended synaptotagmin-1; Binds glycerophospholipids in a barrel-like domain and may play a role in cellular lipid transport (By similarity). Binds calcium (via the C2 domains) and translocates to sites of contact between the endoplasmic reticulum and the cell membrane in response to increased cytosolic calcium levels. Helps tether the endoplasmic reticulum to the cell membrane and promotes the formation of appositions between the endoplasmic reticulum and the cell membrane; Belongs to the extended synaptotagmin family.
218	23345	9606.ENSP00000356224	SYNE1	Nesprin-1; Multi-isomeric modular protein which forms a linking network between organelles and the actin cytoskeleton to maintain the subcellular spatial organization. As a component of the LINC (LInker of Nucleoskeleton and Cytoskeleton) complex involved in the connection between the nuclear lamina and the cytoskeleton. The nucleocytoplasmic interactions established by the LINC complex play an important role in the transmission of mechanical forces across the nuclear envelope and in nuclear movement and positioning. May be involved in nucleus- centrosome attachment and nuclear migrati [...] 
219	23395	9606.ENSP00000498867	LARS2	Probable leucine--tRNA ligase, mitochondrial; leucyl-tRNA synthetase 2, mitochondrial.
220	23708	9606.ENSP00000341247	GSPT2	Eukaryotic peptide chain release factor GTP-binding subunit ERF3B; Involved in translation termination in response to the termination codons UAA, UAG and UGA. May play a role as a potent stimulator of the release factor activity of ETF1. Exhibits GTPase activity, which is ribosome- and ETF1-dependent. May play a role in cell cycle progression. Component of the transient SURF complex which recruits UPF1 to stalled ribosomes in the context of nonsense-mediated decay (NMD) of mRNAs containing premature stop codons.
221	2492	9606.ENSP00000384708	FSHR	Follicle-stimulating hormone receptor; G protein-coupled receptor for follitropin, the follicle- stimulating hormone. Through cAMP production activates the downstream PI3K-AKT and ERK1/ERK2 signaling pathways.
222	2538	9606.ENSP00000253801	G6PC	Glucose-6-phosphatase; Hydrolyzes glucose-6-phosphate to glucose in the endoplasmic reticulum. Forms with the glucose-6-phosphate transporter (SLC37A4/G6PT) the complex responsible for glucose production through glycogenolysis and gluconeogenesis. Hence, it is the key enzyme in homeostatic regulation of blood glucose levels; Belongs to the glucose-6-phosphatase family.
223	255313	9606.ENSP00000389513	CT47A4	Cancer/testis antigen family 47 member A4.
224	256076	9606.ENSP00000265379	COL6A5	Collagen alpha-5(VI) chain; Collagen VI acts as a cell-binding protein.
225	256380	9606.ENSP00000358016	SCML4	Sex comb on midleg-like protein 4; Putative Polycomb group (PcG) protein. PcG proteins act by forming multiprotein complexes, which are required to maintain the transcriptionally repressive state of homeotic genes throughout development (By similarity).
226	259197	9606.ENSP00000342156	NCR3	Natural cytotoxicity triggering receptor 3; Cell membrane receptor of natural killer/NK cells that is activated by binding of extracellular ligands including BAG6 and NCR3LG1. Stimulates NK cells cytotoxicity toward neighboring cells producing these ligands. It controls, for instance, NK cells cytotoxicity against tumor cells. Engagement of NCR3 by BAG6 also promotes myeloid dendritic cells (DC) maturation, both through killing DCs that did not acquire a mature phenotype, and inducing the release by NK cells of TNFA and IFNG which promote DC maturation.
227	25924	9606.ENSP00000301972	MYRIP	Rab effector MyRIP; Rab effector protein involved in melanosome transport. Serves as link between melanosome-bound RAB27A and the motor proteins MYO5A and MYO7A. May link RAB27A-containing vesicles to actin filaments. Functions as a protein kinase A-anchoring protein (AKAP). May act as a scaffolding protein that links PKA to components of the exocytosis machinery, thus facilitating exocytosis, including insulin release (By similarity).
228	25926	9606.ENSP00000253247	NOL11	Nucleolar protein 11; Ribosome biogenesis factor. May be required for both optimal rDNA transcription and small subunit (SSU) pre-rRNA processing at sites A', A0, 1 and 2b.
229	259307	9606.ENSP00000472474	IL4I1	L-amino-acid oxidase; Lysosomal L-amino-acid oxidase with highest specific activity with phenylalanine. May play a role in lysosomal antigen processing and presentation (By similarity).
230	25945	9606.ENSP00000418070	NECTIN3	Nectin-3; Plays a role in cell-cell adhesion through heterophilic trans-interactions with nectin-like proteins or nectins, such as trans- interaction with NECTIN2 at Sertoli-spermatid junctions. Trans- interaction with PVR induces activation of CDC42 and RAC small G proteins through common signaling molecules such as SRC and RAP1. Also involved in the formation of cell-cell junctions, including adherens junctions and synapses. Induces endocytosis-mediated down-regulation of PVR from the cell surface, resulting in reduction of cell movement and proliferation. Plays a role in the morphol [...] 
232	26108	9606.ENSP00000302327	PYGO1	Pygopus homolog 1; Involved in signal transduction through the Wnt pathway.
233	26271	9606.ENSP00000229758	FBXO5	F-box only protein 5; Regulator of APC activity during mitotic and meiotic cell cycle. During mitotic cell cycle plays a role as both substrate and inhibitor of APC-FZR1 complex. During G1 phase, plays a role as substrate of APC-FZR1 complex E3 ligase. Then switches as an inhibitor of APC-FZR1 complex during S and G2 leading to cell-cycle commitment. As APC inhibitor, prevents the degradation of APC substrates at multiple levels: by interacting with APC and blocking access of APC substrates to the D-box coreceptor, formed by FZR1 and ANAPC10; by suppressing ubiquitin ligation and chain [...] 
234	2633	9606.ENSP00000359504	GBP1	Guanylate-binding protein 1; Hydrolyzes GTP to GMP in 2 consecutive cleavage reactions. Exhibits antiviral activity against influenza virus. Promotes oxidative killing and delivers antimicrobial peptides to autophagolysosomes, providing broad host protection against different pathogen classes.
235	2646	9606.ENSP00000264717	GCKR	Glucokinase regulatory protein; Regulates glucokinase (GCK) by forming an inactive complex with this enzyme. Acts by promoting GCK recruitment to the nucleus, possibly to provide a reserve of GCK that can be quickly released in the cytoplasm after a meal. The affinity of GCKR for GCK is modulated by fructose metabolites: GCKR with bound fructose 6-phosphate has increased affinity for GCK, while GCKR with bound fructose 1-phosphate has strongly decreased affinity for GCK and does not inhibit GCK activity.
236	26692	9606.ENSP00000366380	OR2W1	Olfactory receptor 2W1; Odorant receptor; Belongs to the G-protein coupled receptor 1 family.
237	2672	9606.ENSP00000294702	GFI1	Zinc finger protein Gfi-1; Transcription repressor essential for hematopoiesis. Functions in a cell-context and development-specific manner. Binds to 5'-TAAATCAC[AT]GCA-3' in the promoter region of a large number of genes. Component of several complexes, including the EHMT2-GFI1-HDAC1, AJUBA-GFI1-HDAC1 and RCOR-GFI-KDM1A-HDAC complexes, that suppress, via histone deacetylase (HDAC) recruitment, a number of genes implicated in multilineage blood cell development. Regulates neutrophil differentiation, promotes proliferation of lymphoid cells, and is required for granulocyte development.  [...] 
240	270	9606.ENSP00000430075	AMPD1	AMP deaminase 1; AMP deaminase plays a critical role in energy metabolism; Belongs to the metallo-dependent hydrolases superfamily. Adenosine and AMP deaminases family.
241	27153	9606.ENSP00000247930	ZNF777	Zinc finger protein 777; May be involved in transcriptional regulation; Belongs to the krueppel C2H2-type zinc-finger protein family.
242	27285	9606.ENSP00000207457	TEKT2	Tektin-2; Structural component of ciliary and flagellar microtubules. Plays a key role in the assembly or attachment of the inner dynein arm to microtubules in sperm flagella and tracheal cilia. Forms filamentous polymers in the walls of ciliary and flagellar microtubules.
243	2735	9606.ENSP00000228682	GLI1	Zinc finger protein GLI1; Acts as a transcriptional activator. Binds to the DNA consensus sequence 5'-GACCACCCA-3'. Regulates the transcription of specific genes during normal development. Plays a role in craniofacial development and digital development, as well as development of the central nervous system and gastrointestinal tract. Mediates SHH signaling. Plays a role in cell proliferation and differentiation via its role in SHH signaling. Belongs to the GLI C2H2-type zinc-finger protein family.
244	274	9606.ENSP00000316779	BIN1	Myc box-dependent-interacting protein 1; Is a key player in the control of plasma membrane curvature, membrane shaping and membrane remodeling. Required in muscle cells for the formation of T-tubules, tubular invaginations of the plasma membrane that function in depolarization-contraction coupling. Is a negative regulator of endocytosis (By similarity). Is also involved in the regulation of intracellular vesicles sorting, modulation of BACE1 trafficking and the control of amyloid-beta production. In neuronal circuits, endocytosis regulation may influence the internalization of PHF-tau  [...] 
245	2792	9606.ENSP00000248572	GNGT1	Guanine nucleotide-binding protein G(T) subunit gamma-T1; Guanine nucleotide-binding proteins (G proteins) are involved as a modulator or transducer in various transmembrane signaling systems. The beta and gamma chains are required for the GTPase activity, for replacement of GDP by GTP, and for G protein-effector interaction.
246	2829	9606.ENSP00000310405	XCR1	Chemokine XC receptor 1; Receptor for chemokines SCYC1 and SCYC2. Subsequently transduces a signal by increasing the intracellular calcium ions level. Receptor for XCL1/Lymphotactin.
247	282973	9606.ENSP00000499375	JAKMIP3	Janus kinase and microtubule interacting protein 3; Belongs to the JAKMIP family.
249	28316	9606.ENSP00000262717	CDH20	Cadherin-20; Cadherins are calcium-dependent cell adhesion proteins. They preferentially interact with themselves in a homophilic manner in connecting cells; cadherins may thus contribute to the sorting of heterogeneous cell types.
250	283160	9606.ENSP00000485661	OR8D2	Olfactory receptor 8D2; Odorant receptor (Potential). May be involved in taste perception.
252	2833	9606.ENSP00000362795	CXCR3	C-X-C chemokine receptor type 3; [Isoform 1]: Receptor for the C-X-C chemokine CXCL9, CXCL10 and CXCL11 and mediates the proliferation, survival and angiogenic activity of human mesangial cells (HMC) through a heterotrimeric G- protein signaling pathway. Binds to CCL21. Probably promotes cell chemotaxis response. [Isoform 3]: Mediates the activity of CXCL11.
254	283694	9606.ENSP00000332500	OR4N4	Olfactory receptor 4N4; Odorant receptor; Belongs to the G-protein coupled receptor 1 family.
255	284071	9606.ENSP00000386452	MEIOC	Meiosis-specific coiled-coil domain-containing protein MEIOC; Is required for meiosis completion in both male and female germ cells. Confers stability to numerous meiotic mRNAs in gonads allowing proper initiation and progression into meiosis prophase I. The function may involve YTHDC2 and is independent of induction by retinoic acid (RA). Maintains an extended meiotic prophase I by properly promoting the transition from a mitotic to a meiotic cell cycle program by binding transcripts through its interaction with YTHDC2 that regulate the mitotic cell cycle.
260	285429	9606.ENSP00000327796	DCAF4L1	DDB1- and CUL4-associated factor 4-like protein 1; DDB1 and CUL4 associated factor 4 like 1.
262	285755	9606.ENSP00000392257	PPIL6	Probable inactive peptidyl-prolyl cis-trans isomerase-like 6; Probable inactive PPIase with no peptidyl-prolyl cis-trans isomerase activity; Belongs to the cyclophilin-type PPIase family.
268	291	9606.ENSP00000281456	SLC25A4	ADP/ATP translocase 1; Involved in mitochondrial ADP/ATP transport. Catalyzes the exchange of cytoplasmic ADP with mitochondrial ATP across the mitochondrial inner membrane.
269	29122	9606.ENSP00000326598	PRSS50	Probable threonine protease PRSS50; May be involved in proteolysis through its threonine endopeptidase activity; Belongs to the peptidase S1 family.
270	2922	9606.ENSP00000256857	GRP	Gastrin-releasing peptide; Stimulates the release of gastrin and other gastrointestinal hormones (By similarity). Contributes to the perception of prurient stimuli and to the transmission of itch signals in the spinal cord that promote scratching behavior. Contributes primarily to nonhistaminergic itch sensation. Contributes to long-term fear memory, but not normal spatial memory. Contributes to the regulation of food intake (By similarity).
271	29799	9606.ENSP00000342832	YPEL1	Protein yippee-like 1; May play a role in epithelioid conversion of fibroblasts; Belongs to the yippee family.
272	29925	9606.ENSP00000309092	GMPPB	Mannose-1-phosphate guanyltransferase beta; Catalyzes the formation of GDP-mannose, an essential precursor of glycan moieties of glycoproteins and glycolipids. Belongs to the transferase hexapeptide repeat family.
274	3036	9606.ENSP00000222115	HAS1	Hyaluronan synthase 1; Catalyzes the addition of GlcNAc or GlcUA monosaccharides to the nascent hyaluronan polymer. Therefore, it is essential to hyaluronan synthesis a major component of most extracellular matrices that has a structural role in tissues architectures and regulates cell adhesion, migration and differentiation. This is one of the isozymes catalyzing that reaction. Also able to catalyze the synthesis of chito- oligosaccharide depending on the substrate (By similarity). Belongs to the NodC/HAS family.
275	3062	9606.ENSP00000477548	HCRTR2	Orexin receptor type 2; Nonselective, high-affinity receptor for both orexin-A and orexin-B neuropeptides. Triggers an increase in cytoplasmic Ca(2+) levels in response to orexin-A binding.
276	30816	9606.ENSP00000419945	ERVW-1	Transmembrane protein; This endogenous retroviral envelope protein has retained its original fusogenic properties and participates in trophoblast fusion and the formation of a syncytium during placenta morphogenesis. May induce fusion through binding of SLC1A4 and SLC1A5.
277	3084	9606.ENSP00000287842	NRG1	Pro-neuregulin-1, membrane-bound isoform; Direct ligand for ERBB3 and ERBB4 tyrosine kinase receptors. Concomitantly recruits ERBB1 and ERBB2 coreceptors, resulting in ligand-stimulated tyrosine phosphorylation and activation of the ERBB receptors. The multiple isoforms perform diverse functions such as inducing growth and differentiation of epithelial, glial, neuronal, and skeletal muscle cells; inducing expression of acetylcholine receptor in synaptic vesicles during the formation of the neuromuscular junction; stimulating lobuloalveolar budding and milk production in the mammary gla [...] 
278	3161	9606.ENSP00000377492	HMMR	Hyaluronan mediated motility receptor; Receptor for hyaluronic acid (HA) (By similarity). Involved in cell motility (By similarity). When hyaluronan binds to HMMR, the phosphorylation of a number of proteins, including PTK2/FAK1 occurs. May also be involved in cellular transformation and metastasis formation, and in regulating extracellular-regulated kinase (ERK) activity. May act as a regulator of adipogenisis (By similarity).
279	317671	9606.ENSP00000413592	RFESD	Rieske domain-containing protein; Rieske Fe-S domain containing.
280	3293	9606.ENSP00000364412	HSD17B3	Testosterone 17-beta-dehydrogenase 3; Favors the reduction of androstenedione to testosterone. Uses NADPH while the two other EDH17B enzymes use NADH.
281	333	9606.ENSP00000221891	APLP1	Amyloid-like protein 1; May play a role in postsynaptic function. The C-terminal gamma-secretase processed fragment, ALID1, activates transcription activation through APBB1 (Fe65) binding (By similarity). Couples to JIP signal transduction through C-terminal binding. May interact with cellular G-protein signaling pathways. Can regulate neurite outgrowth through binding to components of the extracellular matrix such as heparin and collagen I; Belongs to the APP family.
