#queryIndex	queryItem	stringId	preferredName	annotation
2	1000	9606.ENSP00000269141	CDH2	Cadherin-2; Calcium-dependent cell adhesion protein; preferentially mediates homotypic cell-cell adhesion by dimerization with a CDH2 chain from another cell. Cadherins may thus contribute to the sorting of heterogeneous cell types. Acts as a regulator of neural stem cells quiescence by mediating anchorage of neural stem cells to ependymocytes in the adult subependymal zone: upon cleavage by MMP24, CDH2-mediated anchorage is affected, leading to modulate neural stem cell quiescence. CDH2 may be involved in neuronal recognition mechanism. In hippocampal neurons, may regulate dendritic s [...] 
9	100129128	9606.ENSP00000359415	KHDC1L	Putative KHDC1-like protein; KH domain containing 1 like; Belongs to the KHDC1 family.
12	100130742	9606.ENSP00000343221	LRRC69	Leucine-rich repeat-containing protein 69; Leucine rich repeat containing 69.
15	100131187	9606.ENSP00000388293	TSTD1	Thiosulfate:glutathione sulfurtransferase; Thiosulfate:glutathione sulfurtransferase (TST) required to produce S-sulfanylglutathione (GSS(-)), a central intermediate in hydrogen sulfide metabolism. Provides the link between the first step in mammalian H(2)S metabolism performed by the sulfide:quinone oxidoreductase (SQOR) which catalyzes the conversion of H(2)S to thiosulfate, and the sulfur dioxygenase (SDO) which uses GSS(-) as substrate. The thermodynamic coupling of the irreversible SDO and reversible TST reactions provides a model for the physiologically relevant reaction with thi [...] 
16	100131827	9606.ENSP00000419377	ZNF717	Zinc finger protein 717; May be involved in transcriptional regulation; Belongs to the krueppel C2H2-type zinc-finger protein family.
21	100133941	9606.ENSP00000481841	CD24	Signal transducer CD24; May have a pivotal role in cell differentiation of different cell types. Signaling could be triggered by the binding of a lectin- like ligand to the CD24 carbohydrates, and transduced by the release of second messengers derived from the GPI-anchor. Modulates B-cell activation responses. Promotes AG-dependent proliferation of B-cells, and prevents their terminal differentiation into antibody-forming cells. In association with SIGLEC10 may be involved in the selective suppression of the immune response to danger-associated molecular patterns (DAMPs) such as HMGB1, [...] 
22	100170229	9606.ENSP00000476253	SRRM5	Serine/arginine repetitive matrix 5.
44	10058	9606.ENSP00000265316	ABCB6	ATP-binding cassette sub-family B member 6, mitochondrial; Binds heme and porphyrins and functions in their ATP- dependent uptake into the mitochondria. Plays a crucial role in heme synthesis; Belongs to the ABC transporter superfamily. ABCB family. Heavy Metal importer (TC 3.A.1.210) subfamily.
53	10124	9606.ENSP00000379898	ARL4A	ADP-ribosylation factor-like protein 4A; Small GTP-binding protein which cycles between an inactive GDP-bound and an active GTP-bound form, and the rate of cycling is regulated by guanine nucleotide exchange factors (GEF) and GTPase- activating proteins (GAP). GTP-binding protein that does not act as an allosteric activator of the cholera toxin catalytic subunit. Recruits CYTH1, CYTH2, CYTH3 and CYTH4 to the plasma membrane in GDP-bound form.
97	10225	9606.ENSP00000283285	CD96	T-cell surface protein tactile; May be involved in adhesive interactions of activated T and NK cells during the late phase of the immune response. Promotes NK cell-target adhesion by interacting with PVR present on target cells. May function at a time after T and NK cells have penetrated the endothelium using integrins and selectins, when they are actively engaging diseased cells and moving within areas of inflammation.
98	1026	9606.ENSP00000384849	CDKN1A	Cyclin-dependent kinase inhibitor 1; May be involved in p53/TP53 mediated inhibition of cellular proliferation in response to DNA damage. Binds to and inhibits cyclin- dependent kinase activity, preventing phosphorylation of critical cyclin-dependent kinase substrates and blocking cell cycle progression. Functions in the nuclear localization and assembly of cyclin D-CDK4 complex and promotes its kinase activity towards RB1. At higher stoichiometric ratios, inhibits the kinase activity of the cyclin D- CDK4 complex. Inhibits DNA synthesis by DNA polymerase delta by competing with POLD3  [...] 
103	10316	9606.ENSP00000305877	NMUR1	Neuromedin-U receptor 1; Receptor for the neuromedin-U and neuromedin-S neuropeptides.
105	1043	9606.ENSP00000363330	CD52	CAMPATH-1 antigen; May play a role in carrying and orienting carbohydrate, as well as having a more specific role.
106	10436	9606.ENSP00000470560	EMG1	Ribosomal RNA small subunit methyltransferase NEP1; S-adenosyl-L-methionine-dependent pseudouridine N(1)- methyltransferase that methylates pseudouridine at position 1248 (Psi1248) in 18S rRNA. Involved the biosynthesis of the hypermodified N1-methyl-N3-(3-amino-3-carboxypropyl) pseudouridine (m1acp3-Psi) conserved in eukaryotic 18S rRNA. Is not able to methylate uridine at this position. Has also an essential role in 40S ribosomal subunit biogenesis independent on its methyltransferase activity, facilitating the incorporation of ribosomal protein S19 during the formation of pre-riboso [...] 
107	1048	9606.ENSP00000221992	CEACAM5	Carcinoembryonic antigen-related cell adhesion molecule 5; Cell surface glycoprotein that plays a role in cell adhesion, intracellular signaling and tumor progression. Mediates homophilic and heterophilic cell adhesion with other carcinoembryonic antigen-related cell adhesion molecules, such as CEACAM6. Plays a role as an oncogene by promoting tumor progression; induces resistance to anoikis of colorectal carcinoma cells. Belongs to the immunoglobulin superfamily. CEA family.
108	10561	9606.ENSP00000359783	IFI44	Interferon-induced protein 44; This protein aggregates to form microtubular structures. Belongs to the IFI44 family.
109	10584	9606.ENSP00000332723	COLEC10	Collectin-10; Lectin that binds to various sugars: galactose > mannose = fucose > N-acetylglucosamine > N-acetylgalactosamine. Acts as a chemoattractant, probably involved in the regulation of cell migration ; Belongs to the COLEC10/COLEC11 family.
110	10633	9606.ENSP00000216101	RASL10A	Ras-like protein family member 10A; Potent inhibitor of cellular proliferation.
111	10876	9606.ENSP00000315098	EDDM3A	Epididymal secretory protein E3-alpha; Possible function in sperm maturation.
112	10964	9606.ENSP00000359787	IFI44L	Interferon-induced protein 44-like; Exhibits a low antiviral activity against hepatitis C virus. Belongs to the IFI44 family.
113	11045	9606.ENSP00000478942	UPK1A	Uroplakin-1a; Component of the asymmetric unit membrane (AUM); a highly specialized biomembrane elaborated by terminally differentiated urothelial cells. May play an important role in normal bladder epithelial physiology, possibly in regulating membrane permeability of superficial umbrella cells or in stabilizing the apical membrane through AUM/cytoskeletal interactions (By similarity); Belongs to the tetraspanin (TM4SF) family.
114	11075	9606.ENSP00000429243	STMN2	Stathmin-2; Regulator of microtubule stability. When phosphorylated by MAPK8, stabilizes microtubules and consequently controls neurite length in cortical neurons. In the developing brain, negatively regulates the rate of exit from multipolar stage and retards radial migration from the ventricular zone (By similarity).
115	11130	9606.ENSP00000363055	ZWINT	ZW10 interactor; Part of the MIS12 complex, which is required for kinetochore formation and spindle checkpoint activity. Required to target ZW10 to the kinetochore at prometaphase.
116	11141	9606.ENSP00000368278	IL1RAPL1	Interleukin-1 receptor accessory protein-like 1; May regulate secretion and presynaptic differentiation through inhibition of the activity of N-type voltage-gated calcium channel. May activate the MAP kinase JNK. Plays a role in neurite outgrowth (By similarity). During dendritic spine formation can bidirectionally induce pre- and post-synaptic differentiation of neurons by trans-synaptically binding to PTPRD (By similarity). ECO:0000250|UniProtKB:P59824, ; Belongs to the interleukin-1 receptor family.
117	11162	9606.ENSP00000306070	NUDT6	Nucleoside diphosphate-linked moiety X motif 6; May contribute to the regulation of cell proliferation. Belongs to the Nudix hydrolase family.
118	11184	9606.ENSP00000465039	MAP4K1	Mitogen-activated protein kinase kinase kinase kinase 1; Serine/threonine-protein kinase, which may play a role in the response to environmental stress. Appears to act upstream of the JUN N-terminal pathway. May play a role in hematopoietic lineage decisions and growth regulation. Able to autophosphorylate. Together with CLNK, it enhances CD3-triggered activation of T-cells and subsequent IL2 production (By similarity).
119	11279	9606.ENSP00000417303	KLF8	Krueppel-like factor 8; Transcriptional repressor and activator. Binds to CACCC-boxes promoter elements. Also binds the GT-box of cyclin D1 promoter and mediates cell cycle progression at G(1) phase as a downstream target of focal adhesion kinase (FAK).
120	114026	9606.ENSP00000269834	ZIM3	Zinc finger imprinted 3; May be involved in transcriptional regulation; Belongs to the krueppel C2H2-type zinc-finger protein family.
121	114932	9606.ENSP00000318154	MRFAP1L1	Morf4 family associated protein 1 like 1.
122	115019	9606.ENSP00000356102	SLC26A9	Solute carrier family 26 member 9; DIDS- and thiosulfate- sensitive anion exchanger mediating chloride, sulfate and oxalate transport. Mediates chloride/bicarbonate exchange or chloride-independent bicarbonate extrusion thus assuring bicarbonate secretion. Inhibited by ammonium and thiosulfate. Belongs to the SLC26A/SulP transporter (TC 2.A.53) family.
123	115352	9606.ENSP00000357169	FCRL3	Fc receptor-like protein 3; Promotes TLR9-induced B-cell proliferation, activation and survival but inhibits antibody production and suppresses plasma cell differentiation. Enhances activation of NF-kappa-B and MAPK signaling pathways in TLR9 stimulated B-cells. Has inhibitory potentional on B-cell receptor (BCR)-mediated signaling, possibly through association with SH2 domain-containing phosphatases. Inhibits cell tyrosine phosphorylation, calcium mobilization and activation- induced cell death induced through BCR signaling. Regulatory T-cells expressing FCRL3 exhibit a memory phenoty [...] 
124	115361	9606.ENSP00000359490	GBP4	Guanylate-binding protein 4; Binds GTP, GDP and GMP. Hydrolyzes GTP very efficiently; GDP rather than GMP is the major reaction product. Plays a role in erythroid differentiation (By similarity).
125	1158	9606.ENSP00000221476	CKM	Creatine kinase M-type; Reversibly catalyzes the transfer of phosphate between ATP and various phosphogens (e.g. creatine phosphate). Creatine kinase isoenzymes play a central role in energy transduction in tissues with large, fluctuating energy demands, such as skeletal muscle, heart, brain and spermatozoa.
126	116236	9606.ENSP00000302657	ABHD15	Protein ABHD15; Abhydrolase domain containing 15.
127	116285	9606.ENSP00000301956	ACSM1	Acyl-coenzyme A synthetase ACSM1, mitochondrial; Catalyzes the activation of fatty acids by CoA to produce an acyl-CoA, the first step in fatty acid metabolism. Capable of activating medium-chain fatty acids (e.g. butyric (C4) to decanoic (C10) acids), and certain carboxylate-containing xenobiotics, e.g. benzoate. Also catalyzes the activation of lipoate to lipoyl-nucleoside monophosphate (By similarity). Activates lipoate with GTP at a 1000-fold higher rate than with ATP and activates both (R)- and (S)-lipoate to the respective lipoyl-GMP, with a preference for (R)-lipoate (By similarity).
128	116328	9606.ENSP00000427820	C8orf34	Uncharacterized protein C8orf34; Chromosome 8 open reading frame 34.
129	116535	9606.ENSP00000403660	MRGPRF	Mas-related G-protein coupled receptor member F; Orphan receptor. May bind to a neuropeptide and may regulate nociceptor function and/or development, including the sensation or modulation of pain (By similarity); Belongs to the G-protein coupled receptor 1 family. Mas subfamily.
130	116832	9606.ENSP00000389356	RPL39L	Ribosomal protein L39 like; Belongs to the eukaryotic ribosomal protein eL39 family.
131	118430	9606.ENSP00000311364	MUCL1	Mucin-like protein 1; May play a role as marker for the diagnosis of metastatic breast cancer.
132	120071	9606.ENSP00000385235	LARGE2	LARGE xylosyl- and glucuronyltransferase 2; Bifunctional glycosyltransferase with both xylosyltransferase and beta-1,3-glucuronyltransferase activities involved in the biosynthesis of the phosphorylated O-mannosyl trisaccharide (N- acetylgalactosamine-beta-3-N-acetylglucosamine-beta-4-(phosphate- 6-)mannose), a carbohydrate structure present in alpha-dystroglycan (DAG1). Phosphorylated O-mannosyl trisaccharid is required for binding laminin G-like domain-containing extracellular proteins with high affinity. Elongates the glucuronyl-beta-1,4-xylose-beta disaccharide primer structure by  [...] 
133	121643	9606.ENSP00000299162	FOXN4	Forkhead box protein N4; Transcription factor essential for neural and some non-neural tissues development, such as retina and lung respectively. Binds to an 11-bp consensus sequence containing the invariant tetranucleotide 5'- ACGC-3'. During development of the central nervous system, is required to specify the amacrine and horizontal cell fates from multipotent retinal progenitors while suppressing the alternative photoreceptor cell fates through activating DLL4-NOTCH signaling. Also acts synergistically with ASCL1/MASH1 to activate DLL4-NOTCH signaling and drive commitment of p2 pro [...] 
134	122616	9606.ENSP00000450114	CLBA1	Uncharacterized protein CLBA1; Clathrin binding box of aftiphilin containing 1.
135	122970	9606.ENSP00000323071	ACOT4	Peroxisomal succinyl-coenzyme A thioesterase; Acyl-CoA thioesterases are a group of enzymes that catalyze the hydrolysis of acyl-CoAs to the free fatty acid and coenzyme A (CoASH), providing the potential to regulate intracellular levels of acyl-CoAs, free fatty acids and CoASH. ACOT4 is a peroxisomal succinyl-coenzyme A thioesterase can also hydrolyze glutaryl-CoA and long chain saturated acyl-CoAs.
136	1234	9606.ENSP00000292303	CCR5	C-C chemokine receptor type 5; Receptor for a number of inflammatory CC-chemokines including CCL3/MIP-1-alpha, CCL4/MIP-1-beta and RANTES and subsequently transduces a signal by increasing the intracellular calcium ion level. May play a role in the control of granulocytic lineage proliferation or differentiation.
137	124093	9606.ENSP00000293889	CCDC78	Coiled-coil domain-containing protein 78; Component of the deuterosome, a structure that promotes de novo centriole amplification in multiciliated cells that can generate more than 100 centrioles. Deuterosome-mediated centriole amplification occurs in terminally differentiated multiciliated cells (G1/0) and not in S phase. Essential for centriole amplification and is required for CEP152 localization to the deuterosome.
138	125170	9606.ENSP00000379057	MIEF2	Mitochondrial dynamics protein MID49; Mitochondrial outer membrane protein which regulates mitochondrial organization. It is required for mitochondrial fission and promotes the recruitment and association of the fission mediator dynamin-related protein 1 (DNM1L) to the mitochondrial surface independently of the mitochondrial fission FIS1 and MFF proteins. Regulates DNM1L GTPase activity. Belongs to the MID49/MID51 family.
139	125875	9606.ENSP00000291715	CLDND2	Claudin domain containing 2.
140	127003	9606.ENSP00000358965	C1orf194	Protein C1orf194; May play an important role for the maintenance of myelin-axon integrity (By similarity). May affect intracellular Ca(2+) homeostasis.
141	129607	9606.ENSP00000256722	CMPK2	UMP-CMP kinase 2, mitochondrial; May participate in dUTP and dCTP synthesis in mitochondria. Is able to phosphorylate dUMP, dCMP, CMP, UMP and monophosphates of the pyrimidine nucleoside analogs ddC, dFdC, araC, BVDU and FdUrd with ATP as phosphate donor. Efficacy is highest for dUMP followed by dCMP; CMP and UMP are poor substrates. May be involved in mtDNA depletion caused by long term treatment with ddC or other pyrimidine analogs. Also displays broad nucleoside diphosphate kinase activity.
144	139886	9606.ENSP00000364018	SPIN4	Spindlin-4; Exhibits H3K4me3-binding activity. Belongs to the SPIN/STSY family.
146	140731	9606.ENSP00000396747	ANKRD60	Ankyrin repeat domain 60.
148	1440	9606.ENSP00000225474	CSF3	Granulocyte colony-stimulating factor; Granulocyte/macrophage colony-stimulating factors are cytokines that act in hematopoiesis by controlling the production, differentiation, and function of 2 related white cell populations of the blood, the granulocytes and the monocytes-macrophages. This CSF induces granulocytes; Belongs to the IL-6 superfamily.
149	144809	9606.ENSP00000445786	FAM216B	Protein FAM216B; Family with sequence similarity 216 member B; Belongs to the FAM216 family.
151	146206	9606.ENSP00000334958	CARMIL2	Capping protein, Arp2/3 and myosin-I linker protein 2; Cell membrane-cytoskeleton-associated protein that plays a role in the regulation of actin polymerization at the barbed end of actin filaments. Prevents F-actin heterodimeric capping protein (CP) activity at the leading edges of migrating cells, and hence generates uncapped barbed ends and enhances actin polymerization. Plays a role in cell protrusion formations; involved in cell polarity, lamellipodial assembly, membrane ruffling and macropinosome formations. Involved as well in cell migration and invadopodia formation during woun [...] 
152	146760	9606.ENSP00000330631	RTN4RL1	Reticulon-4 receptor-like 1; Cell surface receptor. Plays a functionally redundant role in postnatal brain development and in regulating axon regeneration in the adult central nervous system. Contributes to normal axon migration across the brain midline and normal formation of the corpus callosum. Protects motoneurons against apoptosis; protection against apoptosis is probably mediated by MAG. Plays a role in inhibiting neurite outgrowth and axon regeneration via its binding to neuronal chondroitin sulfate proteoglycans. Binds heparin (By similarity). Like other family members, plays a [...] 
153	146857	9606.ENSP00000285013	SLFN13	Schlafen family member 13; Endoribonuclease that cleaves tRNAs and rRNAs. Cleaves tRNAs 11 nucleotides from the 3'-terminus at the acceptor stem. Does not act on tRNA(Sec). Able to restrict HIV-1 virus replication; ability to inhibit HIV-1 replication is dependent on endoribonuclease activity.
154	147372	9606.ENSP00000497183	CCBE1	Collagen and calcium-binding EGF domain-containing protein 1; Required for lymphangioblast budding and angiogenic sprouting from venous endothelium during embryogenesis. Belongs to the CCBE1 family.
155	148170	9606.ENSP00000301200	CDC42EP5	Cdc42 effector protein 5; Probably involved in the organization of the actin cytoskeleton. May act downstream of CDC42 to induce actin filament assembly leading to cell shape changes. Induces pseudopodia formation in fibroblasts. Inhibits MAPK8 independently of CDC42 binding. Controls septin organization and this effect is negatively regulated by CDC42 (By similarity); Belongs to the BORG/CEP family.
156	148738	9606.ENSP00000337014	HJV	Hemojuvelin; Acts as a bone morphogenetic protein (BMP) coreceptor. Through enhancement of BMP signaling regulates hepcidin (HAMP) expression and regulates iron homeostasis. Belongs to the repulsive guidance molecule (RGM) family.
157	148870	9606.ENSP00000294600	CCDC27	Coiled-coil domain containing 27.
158	148930	9606.ENSP00000419705	KNCN	Kinocilin; May play a role in stabilizing dense microtubular networks or in vesicular trafficking.
159	149499	9606.ENSP00000336661	LRRC71	Leucine-rich repeat-containing protein 71; Leucine rich repeat containing 71.
160	150379	9606.ENSP00000216177	PNPLA5	Patatin-like phospholipase domain-containing protein 5; Lipid hydrolase.
161	1504	9606.ENSP00000354294	CTRB1	Chymotrypsinogen B1; Belongs to the peptidase S1 family.
162	151230	9606.ENSP00000376419	KLHL23	Kelch-like protein 23; Kelch like family member 23.
163	151649	9606.ENSP00000373702	PP2D1	Protein phosphatase 2C like domain containing 1.
164	153562	9606.ENSP00000323264	MARVELD2	MARVEL domain-containing protein 2; Plays a role in the formation of tricellular tight junctions and of epithelial barriers (By similarity). Required for normal hearing via its role in the separation of the endolymphatic and perilymphatic spaces of the organ of Corti in the inner ear, and for normal survival of hair cells in the organ of Corti.
166	154467	9606.ENSP00000362507	CCDC167	Coiled-coil domain containing 167.
167	154661	9606.ENSP00000337732	RUNDC3B	RUN domain containing 3B.
169	154796	9606.ENSP00000361027	AMOT	Angiomotin; Plays a central role in tight junction maintenance via the complex formed with ARHGAP17, which acts by regulating the uptake of polarity proteins at tight junctions. Appears to regulate endothelial cell migration and tube formation. May also play a role in the assembly of endothelial cell-cell junctions; Belongs to the angiomotin family.
171	157285	9606.ENSP00000481109	PRAG1	Inactive tyrosine-protein kinase PRAG1; Catalytically inactive protein kinase that acts as a scaffold protein. Functions as an effector of the small GTPase RND2, which stimulates RhoA activity and inhibits NGF-induced neurite outgrowth (By similarity). Promotes Src family kinase (SFK) signaling by regulating the subcellular localization of CSK, a negative regulator of these kinases, leading to the regulation of cell morphology and motility by a CSK-dependent mechanism (By similarity). Acts as a critical coactivator of Notch signaling (By similarity).
174	158405	9606.ENSP00000440504	KIAA1958	Uncharacterized protein KIAA1958; KIAA1958.
175	1607	9606.ENSP00000385780	DGKB	Diacylglycerol kinase beta; Exhibits high phosphorylation activity for long-chain diacylglycerols.
176	161357	9606.ENSP00000405456	MDGA2	MAM domain-containing glycosylphosphatidylinositol anchor protein 2; May be involved in cell-cell interactions.
177	162083	9606.ENSP00000500329	C16orf82	Protein TNT; Chromosome 16 open reading frame 82.
178	162466	9606.ENSP00000406909	PHOSPHO1	Phosphoethanolamine/phosphocholine phosphatase; Phosphatase that has a high activity toward phosphoethanolamine (PEA) and phosphocholine (PCho). Involved in the generation of inorganic phosphate for bone mineralization.
179	162517	9606.ENSP00000321386	FBXO39	F-box only protein 39; Substrate-recognition component of the SCF (SKP1-CUL1-F-box protein)-type E3 ubiquitin ligase complex.
180	162699	9606.ENSP00000483981	ELOA3	Elongin-A3; SIII, also known as elongin, is a general transcription elongation factor that increases the RNA polymerase II transcription elongation past template-encoded arresting sites. Subunit A3 is transcriptionally active but its transcription activity is not enhanced by binding to the dimeric complex of the SIII regulatory subunits B and C (elongin BC complex).
181	162979	9606.ENSP00000302770	ZNF296	Zinc finger protein 296; May be a transcriptional corepressor with KLF4.
182	1641	9606.ENSP00000490614	DCX	Neuronal migration protein doublecortin; Microtubule-associated protein required for initial steps of neuronal dispersion and cortex lamination during cerebral cortex development. May act by competing with the putative neuronal protein kinase DCLK1 in binding to a target protein. May in that way participate in a signaling pathway that is crucial for neuronal interaction before and during migration, possibly as part of a calcium ion-dependent signal transduction pathway. May be part with PAFAH1B1/LIS-1 of overlapping, but distinct, signaling pathways that promote neuronal migration.
183	164153	9606.ENSP00000334044	UBL4B	Ubiquitin-like protein 4B; Ubiquitin like 4B.
184	1646	9606.ENSP00000370129	AKR1C2	Aldo-keto reductase family 1 member C2; Works in concert with the 5-alpha/5-beta-steroid reductases to convert steroid hormones into the 3-alpha/5-alpha and 3-alpha/5- beta-tetrahydrosteroids. Catalyzes the inactivation of the most potent androgen 5-alpha-dihydrotestosterone (5-alpha-DHT) to 5-alpha- androstane-3-alpha,17-beta-diol (3-alpha-diol). Has a high bile-binding ability.
185	165679	9606.ENSP00000352097	SPTSSB	Serine palmitoyltransferase small subunit B; Stimulates the activity of serine palmitoyltransferase (SPT). The composition of the serine palmitoyltransferase (SPT) complex determines the substrate preference, complexes with this subunit showing a clear preference for longer acyl-CoAs. The SPTLC1-SPTLC2- SPTSSB complex shows a strong preference for C18-CoA substrate, while the SPTLC1-SPTLC3-SPTSSB isozyme displays an ability to use a broader range of acyl-CoAs, without apparent preference. May play a role in signal transduction.
186	167465	9606.ENSP00000313158	ZNF366	Zinc finger protein 366; Has transcriptional repression activity. Acts as corepressor of ESR1; the function seems to involve CTBP1 and histone deacetylases.
187	1678	9606.ENSP00000361993	TIMM8A	Mitochondrial import inner membrane translocase subunit Tim8 A; Mitochondrial intermembrane chaperone that participates in the import and insertion of some multi-pass transmembrane proteins into the mitochondrial inner membrane. Also required for the transfer of beta-barrel precursors from the TOM complex to the sorting and assembly machinery (SAM complex) of the outer membrane. Acts as a chaperone-like protein that protects the hydrophobic precursors from aggregation and guide them through the mitochondrial intermembrane space. The TIMM8- TIMM13 complex mediates the import of proteins [...] 
