#queryIndex	queryItem	stringId	preferredName	annotation
457	64321	9606.ENSP00000297316	SOX17	Transcription factor SOX-17; Acts as transcription regulator that binds target promoter DNA and bends the DNA. Binds to the sequences 5'-AACAAT-'3 or 5'- AACAAAG-3'. Modulates transcriptional regulation via WNT3A. Inhibits Wnt signaling. Promotes degradation of activated CTNNB1. Plays a key role in the regulation of embryonic development. Required for normal development of the definitive gut endoderm. Required for normal looping of the embryonic heart tube. Plays an important role in embryonic and postnatal vascular development, including development of arteries. Plays an important rol [...] 
461	644591	9606.ENSP00000393845	PPIAL4G	Peptidyl-prolyl cis-trans isomerase A-like 4G; PPIases accelerate the folding of proteins. It catalyzes the cis-trans isomerization of proline imidic peptide bonds in oligopeptides (By similarity); Belongs to the cyclophilin-type PPIase family. PPIase A subfamily.
462	645745	9606.ENSP00000476141	MT1HL1	Metallothionein 1H-like protein 1; Metallothioneins have a high content of cysteine residues that bind various heavy metals; these proteins are transcriptionally regulated by both heavy metals and glucocorticoids; Belongs to the metallothionein superfamily. Type 1 family.
463	64699	9606.ENSP00000411013	TMPRSS3	Transmembrane protease serine 3; Probable serine protease that plays a role in hearing. Acts as a permissive factor for cochlear hair cell survival and activation at the onset of hearing and is required for saccular hair cell survival (By similarity). Activates ENaC (in vitro).
464	64798	9606.ENSP00000286234	DEPTOR	DEP domain-containing mTOR-interacting protein; Negative regulator of the mTORC1 and mTORC2 signaling pathways. Inhibits the kinase activity of both complexes.
465	6504	9606.ENSP00000438406	SLAMF1	Signaling lymphocytic activation molecule; Self-ligand receptor of the signaling lymphocytic activation molecule (SLAM) family. SLAM receptors triggered by homo- or heterotypic cell-cell interactions are modulating the activation and differentiation of a wide variety of immune cells and thus are involved in the regulation and interconnection of both innate and adaptive immune response. Activities are controlled by presence or absence of small cytoplasmic adapter proteins, SH2D1A/SAP and/or SH2D1B/EAT-2. SLAMF1-induced signal-transduction events in T-lymphocytes are different from those [...] 
466	65243	9606.ENSP00000354547	ZFP69B	Zinc finger protein 69 homolog B; May be involved in transcriptional regulation. Essential for Golgi structural integrity.
467	653509	9606.ENSP00000397082	SFTPA1	Pulmonary surfactant-associated protein A1; In presence of calcium ions, it binds to surfactant phospholipids and contributes to lower the surface tension at the air- liquid interface in the alveoli of the mammalian lung and is essential for normal respiration. Enhances the expression of MYO18A/SP-R210 on alveolar macrophages (By similarity).
468	656	9606.ENSP00000361915	BMP8B	Bone morphogenetic protein 8B; Induces cartilage and bone formation. May be the osteoinductive factor responsible for the phenomenon of epithelial osteogenesis. Plays a role in calcium regulation and bone homeostasis (By similarity); Belongs to the TGF-beta family.
469	6563	9606.ENSP00000390637	SLC14A1	Urea transporter 1; Urea channel that facilitates transmembrane urea transport down a concentration gradient. A constriction of the transmembrane channel functions as selectivity filter through which urea is expected to pass in dehydrated form. The rate of urea conduction is increased by hypotonic stress. Plays an important role in the kidney medulla collecting ducts, where it allows rapid equilibration between the lumen of the collecting ducts and the interstitium, and thereby prevents water loss driven by the high concentration of urea in the urine. Facilitates urea transport across  [...] 
470	6588	9606.ENSP00000435380	SLN	Sarcolipin; Reversibly inhibits the activity of ATP2A1 in sarcoplasmic reticulum by decreasing the apparent affinity of the ATPase for Ca(2+). Modulates calcium re-uptake during muscle relaxation and plays an important role in calcium homeostasis in muscle. Required for muscle- based, non-shivering thermogenesis (By similarity). Belongs to the sarcolipin family.
471	6614	9606.ENSP00000341141	SIGLEC1	Sialoadhesin; Acts as an endocytic receptor mediating clathrin dependent endocytosis. Macrophage-restricted adhesion molecule that mediates sialic-acid dependent binding to lymphocytes, including granulocytes, monocytes, natural killer cells, B-cells and CD8 T-cells. Preferentially binds to alpha-2,3-linked sialic acid (By similarity). Binds to SPN/CD43 on T-cells (By similarity). May play a role in hemopoiesis.
472	6648	9606.ENSP00000446252	SOD2	Superoxide dismutase [Mn], mitochondrial; Destroys superoxide anion radicals which are normally produced within the cells and which are toxic to biological systems. Belongs to the iron/manganese superoxide dismutase family.
473	6649	9606.ENSP00000371554	SOD3	Extracellular superoxide dismutase [Cu-Zn]; Protect the extracellular space from toxic effect of reactive oxygen intermediates by converting superoxide radicals into hydrogen peroxide and oxygen.
474	670	9606.ENSP00000369739	BPHL	Valacyclovir hydrolase; Serine hydrolase that catalyzes the hydrolytic activation of amino acid ester prodrugs of nucleoside analogs such as valacyclovir and valganciclovir. Activates valacyclovir to acyclovir. May play a role in detoxification processes. It is a specific alpha-amino acid ester hydrolase that prefers small, hydrophobic, and aromatic side chains and does not have a stringent requirement for the leaving group other than preferring a primary alcohol; Belongs to the AB hydrolase superfamily. Lipase family.
475	6707	9606.ENSP00000330391	SPRR3	Small proline-rich protein 3; Cross-linked envelope protein of keratinocytes.
476	6722	9606.ENSP00000265354	SRF	Serum response factor; SRF is a transcription factor that binds to the serum response element (SRE), a short sequence of dyad symmetry located 300 bp to the 5' of the site of transcription initiation of some genes (such as FOS). Together with MRTFA transcription coactivator, controls expression of genes regulating the cytoskeleton during development, morphogenesis and cell migration. The SRF-MRTFA complex activity responds to Rho GTPase-induced changes in cellular globular actin (G- actin) concentration, thereby coupling cytoskeletal gene expression to cytoskeletal dynamics. Required f [...] 
477	6772	9606.ENSP00000354394	STAT1	Signal transducer and activator of transcription 1-alpha/beta; Signal transducer and transcription activator that mediates cellular responses to interferons (IFNs), cytokine KITLG/SCF and other cytokines and other growth factors. Following type I IFN (IFN-alpha and IFN-beta) binding to cell surface receptors, signaling via protein kinases leads to activation of Jak kinases (TYK2 and JAK1) and to tyrosine phosphorylation of STAT1 and STAT2. The phosphorylated STATs dimerize and associate with ISGF3G/IRF-9 to form a complex termed ISGF3 transcription factor, that enters the nucleus. ISGF [...] 
478	6779	9606.ENSP00000246895	STATH	Statherin; Salivary protein that stabilizes saliva supersaturated with calcium salts by inhibiting the precipitation of calcium phosphate salts. It also modulates hydroxyapatite crystal formation on the tooth surface.
479	6898	9606.ENSP00000348234	TAT	Tyrosine aminotransferase; Transaminase involved in tyrosine breakdown. Converts tyrosine to p-hydroxyphenylpyruvate. Can catalyze the reverse reaction, using glutamic acid, with 2-oxoglutarate as cosubstrate (in vitro). Has much lower affinity and transaminase activity towards phenylalanine.
480	6909	9606.ENSP00000240328	TBX2	T-box transcription factor TBX2; Involved in the transcriptional regulation of genes required for mesoderm differentiation. Probably plays a role in limb pattern formation. Acts as a negative regulator of PML function in cellular senescence. May be required for cardiac atrioventricular canal formation.
481	6913	9606.ENSP00000358437	TBX15	T-box transcription factor TBX15; Probable transcriptional regulator involved in the development of the skeleton of the limb, vertebral column and head. Acts by controlling the number of mesenchymal precursor cells and chondrocytes (By similarity).
483	6943	9606.ENSP00000356857	TCF21	Transcription factor 21; Involved in epithelial-mesenchymal interactions in kidney and lung morphogenesis that include epithelial differentiation and branching morphogenesis. May play a role in the specification or differentiation of one or more subsets of epicardial cell types.
484	6947	9606.ENSP00000257264	TCN1	Transcobalamin-1; Binds vitamin B12 with femtomolar affinity and protects it from the acidic environment of the stomach; Belongs to the eukaryotic cobalamin transport proteins family.
485	6975	9606.ENSP00000494896	TECTB	Beta-tectorin; One of the major non-collagenous components of the tectorial membrane (By similarity). The tectorial membrane is an extracellular matrix of the inner ear that covers the neuroepithelium of the cochlea and contacts the stereocilia bundles of specialized sensory hair cells. Sound induces movement of these hair cells relative to the tectorial membrane, deflects the stereocilia and leads to fluctuations in hair- cell membrane potential, transducing sound into electrical signals.
486	7025	9606.ENSP00000325819	NR2F1	COUP transcription factor 1; Coup (chicken ovalbumin upstream promoter) transcription factor binds to the ovalbumin promoter and, in conjunction with another protein (S300-II) stimulates initiation of transcription. Binds to both direct repeats and palindromes of the 5'-AGGTCA-3' motif. Represses transcriptional activity of LHCG.
487	7057	9606.ENSP00000260356	THBS1	Thrombospondin-1; Adhesive glycoprotein that mediates cell-to-cell and cell-to- matrix interactions. Binds heparin. May play a role in dentinogenesis and/or maintenance of dentin and dental pulp (By similarity). Ligand for CD36 mediating antiangiogenic properties. Plays a role in ER stress response, via its interaction with the activating transcription factor 6 alpha (ATF6) which produces adaptive ER stress response factors (By similarity).
488	7163	9606.ENSP00000429309	TPD52	Tumor protein D52; Belongs to the TPD52 family.
489	718	9606.ENSP00000245907	C3	Complement C3c alpha' chain fragment 1; C3 plays a central role in the activation of the complement system. Its processing by C3 convertase is the central reaction in both classical and alternative complement pathways. After activation C3b can bind covalently, via its reactive thioester, to cell surface carbohydrates or immune aggregates. [C3-beta-c]: Acts as a chemoattractant for neutrophils in chronic inflammation.
492	729	9606.ENSP00000263413	C6	Complement component C6; Constituent of the membrane attack complex (MAC) that plays a key role in the innate and adaptive immune response by forming pores in the plasma membrane of target cells.
495	729993	9606.ENSP00000454014	SHISA9	Protein shisa-9; Regulator of short-term neuronal synaptic plasticity in the dentate gyrus. Associates with AMPA receptors (ionotropic glutamate receptors) in synaptic spines and promotes AMPA receptor desensitization at excitatory synapses (By similarity); Belongs to the shisa family. SHISA9 subfamily.
498	7481	9606.ENSP00000325526	WNT11	Protein Wnt-11; Ligand for members of the frizzled family of seven transmembrane receptors. Probable developmental protein. May be a signaling molecule which affects the development of discrete regions of tissues. Is likely to signal over only few cell diameters.
499	786	9606.ENSP00000226021	CACNG1	Voltage-dependent calcium channel gamma-1 subunit; Regulatory subunit of the voltage-gated calcium channel that gives rise to L-type calcium currents in skeletal muscle. Regulates channel inactivation kinetics; Belongs to the PMP-22/EMP/MP20 family. CACNG subfamily.
500	78990	9606.ENSP00000203664	OTUB2	Ubiquitin thioesterase OTUB2; Hydrolase that can remove conjugated ubiquitin from proteins in vitro and may therefore play an important regulatory role at the level of protein turnover by preventing degradation. Mediates deubiquitination of 'Lys-11'-,'Lys-48'- and 'Lys-63'-linked polyubiquitin chains, with a preference for 'Lys-63'-linked polyubiquitin chains; Belongs to the peptidase C65 family.
501	79152	9606.ENSP00000219368	FA2H	Fatty acid 2-hydroxylase; Catalyzes the hydroxylation of free fatty acids at the C-2 position to produce 2-hydroxy fatty acids, which are building blocks of sphingolipids and glycosphingolipids common in neural tissue and epidermis. FA2H is stereospecific for the production of (R)-2- hydroxy fatty acids. Plays an essential role in the synthesis of galactosphingolipids of the myelin sheath (By similarity). Responsible for the synthesis of sphingolipids and glycosphingolipids involved in the formation of epidermal lamellar bodies critical for skin permeability barrier. Participates in th [...] 
502	79173	9606.ENSP00000254336	C19orf57	Uncharacterized protein C19orf57; Chromosome 19 open reading frame 57.
503	793	9606.ENSP00000265431	CALB1	Calbindin; Buffers cytosolic calcium. May stimulate a membrane Ca(2+)- ATPase and a 3',5'-cyclic nucleotide phosphodiesterase.
504	79574	9606.ENSP00000358820	EPS8L3	Epidermal growth factor receptor kinase substrate 8-like protein 3; EPS8 like 3.
505	79703	9606.ENSP00000354227	C11orf80	Type 2 DNA topoisomerase 6 subunit B-like; [Isoform 3]: Component of a topoisomerase 6 complex specifically required for meiotic recombination. Together with SPO11, mediates DNA cleavage that forms the double-strand breaks (DSB) that initiate meiotic recombination. The complex promotes relaxation of negative and positive supercoiled DNA and DNA decatenation through cleavage and ligation cycles.
506	79777	9606.ENSP00000405969	ACBD4	Acyl-CoA-binding domain-containing protein 4; Binds medium- and long-chain acyl-CoA esters and may function as an intracellular carrier of acyl-CoA esters.
507	79831	9606.ENSP00000398410	KDM8	Bifunctional peptidase and arginyl-hydroxylase JMJD5; Bifunctional enzyme that acts both as an endopeptidase and 2- oxoglutarate-dependent monoxygenase. Endopeptidase that cleaves histones N-terminal tails at the carboxyl side of methylated arginine or lysine residues, to generate 'tailless nucleosomes', which may trigger transcription elongation. Preferentially recognizes and cleaves monomethylated and dimethylated arginine residues of histones H2, H3 and H4. After initial cleavage, continues to digest histones tails via its aminopeptidase activity. Upon DNA damage, cleaves the N-term [...] 
508	79973	9606.ENSP00000242804	ZNF442	Zinc finger protein 442; May be involved in transcriptional regulation.
510	80178	9606.ENSP00000355022	TEDC2	Tubulin epsilon and delta complex protein 2; Acts as a positive regulator of ciliary hedgehog signaling. Required for centriole stability.
511	80975	9606.ENSP00000299882	TMPRSS5	Transmembrane protease serine 5; May play a role in hearing; Belongs to the peptidase S1 family.
512	81031	9606.ENSP00000352216	SLC2A10	Solute carrier family 2, facilitated glucose transporter member 10; Facilitative glucose transporter required for the development of the cardiovascular system; Belongs to the major facilitator superfamily. Sugar transporter (TC 2.A.1.1) family. Glucose transporter subfamily.
513	81490	9606.ENSP00000308258	PTDSS2	Phosphatidylserine synthase 2; Catalyzes a base-exchange reaction in which the polar head group of phosphatidylethanolamine (PE) or phosphatidylcholine (PC) is replaced by L-serine. PTDSS2 is specific for phosphatatidylethanolamine and does not act on phosphatidylcholine; Belongs to the phosphatidyl serine synthase family.
514	81577	9606.ENSP00000268797	GFOD2	Glucose-fructose oxidoreductase domain-containing protein 2; Promotes matrix assembly.
515	8317	9606.ENSP00000393139	CDC7	Cell division cycle 7-related protein kinase; Seems to phosphorylate critical substrates that regulate the G1/S phase transition and/or DNA replication. Can phosphorylates MCM2 and MCM3; Belongs to the protein kinase superfamily. Ser/Thr protein kinase family. CDC7 subfamily.
516	8348	9606.ENSP00000477527	H2BC17	Histone H2B type 1-O; Core component of nucleosome. Nucleosomes wrap and compact DNA into chromatin, limiting DNA accessibility to the cellular machineries which require DNA as a template. Histones thereby play a central role in transcription regulation, DNA repair, DNA replication and chromosomal stability. DNA accessibility is regulated via a complex set of post-translational modifications of histones, also called histone code, and nucleosome remodeling.
517	83893	9606.ENSP00000341765	SPATA16	Spermatogenesis-associated protein 16; Involved in the formation of sperm acrosome, which implicated its potential role in spermatogenesis and sperm-egg fusion.
518	84140	9606.ENSP00000385158	FAM161A	Protein FAM161A; Involved in ciliogenesis.
519	84159	9606.ENSP00000279873	ARID5B	AT-rich interactive domain-containing protein 5B; Transcription coactivator that binds to the 5'-AATA[CT]-3' core sequence and plays a key role in adipogenesis and liver development. Acts by forming a complex with phosphorylated PHF2, which mediates demethylation at Lys-336, leading to target the PHF2-ARID5B complex to target promoters, where PHF2 mediates demethylation of dimethylated 'Lys-9' of histone H3 (H3K9me2), followed by transcription activation of target genes. The PHF2-ARID5B complex acts as a coactivator of HNF4A in liver. Required for adipogenesis: regulates triglyceride m [...] 
520	84182	9606.ENSP00000265299	MINDY4	Probable ubiquitin carboxyl-terminal hydrolase MINDY-4; Probable hydrolase that can remove 'Lys-48'-linked conjugated ubiquitin from proteins; Belongs to the MINDY deubiquitinase family. FAM188 subfamily.
521	84246	9606.ENSP00000255764	MED10	Mediator of RNA polymerase II transcription subunit 10; Component of the Mediator complex, a coactivator involved in the regulated transcription of nearly all RNA polymerase II-dependent genes. Mediator functions as a bridge to convey information from gene- specific regulatory proteins to the basal RNA polymerase II transcription machinery. Mediator is recruited to promoters by direct interactions with regulatory proteins and serves as a scaffold for the assembly of a functional preinitiation complex with RNA polymerase II and the general transcription factors.
523	84467	9606.ENSP00000270509	FBN3	Fibrillin-3 C-terminal peptide; [Fibrillin-3]: Fibrillins are structural components of 10-12 nm extracellular calcium-binding microfibrils, which occur either in association with elastin or in elastin-free bundles. Fibrillin- containing microfibrils provide long-term force bearing structural support; Belongs to the fibrillin family.
524	84501	9606.ENSP00000367494	SPIRE2	Protein spire homolog 2; Acts as an actin nucleation factor, remains associated with the slow-growing pointed end of the new filament. Involved in intracellular vesicle transport along actin fibers, providing a novel link between actin cytoskeleton dynamics and intracellular transport (By similarity). Required for asymmetric spindle positioning and asymmetric cell division during meiosis. Required for normal formation of the cleavage furrow and for polar body extrusion during female germ cell meiosis. Also acts in the nucleus: together with SPIRE1 and SPIRE2, promotes assembly of nucle [...] 
525	84515	9606.ENSP00000368164	MCM8	DNA helicase MCM8; Component of the MCM8-MCM9 complex, a complex involved in the repair of double-stranded DNA breaks (DBSs) and DNA interstrand cross- links (ICLs) by homologous recombination (HR). Required for DNA resection by the MRE11-RAD50-NBN/NBS1 (MRN) complex by recruiting the MRN complex to the repair site and by promoting the complex nuclease activity. Probably by regulating the localization of the MNR complex, indirectly regulates the recruitment of downstream effector RAD51 to DNA damage sites including DBSs and ICLs. The MCM8-MCM9 complex is dispensable for DNA replication [...] 
526	84518	9606.ENSP00000222032	CNFN	Cornifelin; Part of the insoluble cornified cell envelope (CE) of stratified squamous epithelia; Belongs to the cornifelin family.
527	8455	9606.ENSP00000262919	ATRN	Attractin; Involved in the initial immune cell clustering during inflammatory response and may regulate chemotactic activity of chemokines. May play a role in melanocortin signaling pathways that regulate energy homeostasis and hair color. Low-affinity receptor for agouti (By similarity). Has a critical role in normal myelination in the central nervous system (By similarity).
528	84553	9606.ENSP00000374328	FAXC	Failed axon connections homolog; May play a role in axonal development.
529	84688	9606.ENSP00000297623	C9orf24	Spermatid-specific manchette-related protein 1; May play a role in spermatogenesis (By similarity). May be involved in differentiation or function of ciliated cells. Belongs to the SMRP1 family.
530	8479	9606.ENSP00000279392	HIRIP3	HIRA-interacting protein 3; May play a role in chromatin function and histone metabolism via its interaction with HIRA and histones.
531	84842	9606.ENSP00000335060	HPDL	4-hydroxyphenylpyruvate dioxygenase-like protein; May have dioxygenase activity; Belongs to the 4HPPD family.
532	84866	9606.ENSP00000431548	TMEM25	Transmembrane protein 25; In neurons, modulates the degradation of NMDA receptor GRIN2B subunit. Plays a role in the regulation of neuronal excitability.
533	85016	9606.ENSP00000414390	CFAP300	Cilia- and flagella-associated protein 300; Cilium- and flagellum-specific protein that plays a role in axonemal structure organization and motility. May play a role in outer and inner dynein arm assembly.
534	85285	9606.ENSP00000381489	KRTAP4-1	Keratin-associated protein 4-1; In the hair cortex, hair keratin intermediate filaments are embedded in an interfilamentous matrix, consisting of hair keratin- associated proteins (KRTAP), which are essential for the formation of a rigid and resistant hair shaft through their extensive disulfide bond cross-linking with abundant cysteine residues of hair keratins. The matrix proteins include the high-sulfur and high-glycine-tyrosine keratins; Belongs to the KRTAP type 4 family.
535	8605	9606.ENSP00000472546	PLA2G4C	Cytosolic phospholipase A2 gamma; Has a preference for arachidonic acid at the sn-2 position of phosphatidylcholine as compared with palmitic acid.
536	8630	9606.ENSP00000451406	HSD17B6	17-beta-hydroxysteroid dehydrogenase type 6; NAD-dependent oxidoreductase with broad substrate specificity that shows both oxidative and reductive activity (in vitro). Has 17- beta-hydroxysteroid dehydrogenase activity towards various steroids (in vitro). Converts 5-alpha-androstan-3-alpha,17-beta-diol to androsterone and estradiol to estrone (in vitro). Has 3-alpha-hydroxysteroid dehydrogenase activity towards androsterone (in vitro). Has retinol dehydrogenase activity towards all-trans-retinol (in vitro). Can convert androsterone to epi-androsterone. Androsterone is first oxidized to [...] 
537	8823	9606.ENSP00000399324	FGF16	Fibroblast growth factor 16; Plays an important role in the regulation of embryonic development, cell proliferation and cell differentiation, and is required for normal cardiomyocyte proliferation and heart development. Belongs to the heparin-binding growth factors family.
538	894	9606.ENSP00000261254	CCND2	G1/S-specific cyclin-D2; Regulatory component of the cyclin D2-CDK4 (DC) complex that phosphorylates and inhibits members of the retinoblastoma (RB) protein family including RB1 and regulates the cell-cycle during G(1)/S transition. Phosphorylation of RB1 allows dissociation of the transcription factor E2F from the RB/E2F complex and the subsequent transcription of E2F target genes which are responsible for the progression through the G(1) phase. Hypophosphorylates RB1 in early G(1) phase. Cyclin D-CDK4 complexes are major integrators of various mitogenenic and antimitogenic signals. A [...] 
539	89890	9606.ENSP00000368799	KBTBD6	Kelch repeat and BTB domain containing 6.
540	90060	9606.ENSP00000474071	CCDC120	Coiled-coil domain-containing protein 120; Centriolar protein required for centriole subdistal appendage assembly and microtubule anchoring in interphase cells. Together with CCDC68, cooperate with subdistal appendage components ODF2, NIN and CEP170 for hierarchical subdistal appendage assembly. Recruits NIN and CEP170 to centrosomes. Also required for neurite growth. Localizes CYTH2 to vesicles to allow its transport along neurites, and subsequent ARF6 activation and neurite growth.
541	90161	9606.ENSP00000429473	HS6ST2	Heparan-sulfate 6-O-sulfotransferase 2; 6-O-sulfation enzyme which catalyzes the transfer of sulfate from 3'-phosphoadenosine 5'-phosphosulfate (PAPS) to position 6 of the N-sulfoglucosamine residue (GlcNS) of heparan sulfate.
542	90167	9606.ENSP00000298542	FRMD7	FERM domain-containing protein 7; Plays a role in neurite development, may be through the activation of the GTPase RAC1. Plays a role in the control of eye movement and gaze stability.
543	9048	9606.ENSP00000387435	ARTN	Artemin; Ligand for the GFR-alpha-3-RET receptor complex but can also activate the GFR-alpha-1-RET receptor complex. Supports the survival of sensory and sympathetic peripheral neurons in culture and also supports the survival of dopaminergic neurons of the ventral mid-brain. Strong attractant of gut hematopoietic cells thus promoting the formation Peyer's patch-like structures, a major component of the gut-associated lymphoid tissue.
544	90594	9606.ENSP00000305077	ZNF439	Zinc finger protein 439; May be involved in transcriptional regulation.
